{
  "act_body_id": "sha256:d4b498a91e2da6e17137f3b1ead8ec83223149416cf4f4ee01e014e052c447e2",
  "act_kind": "merge_change_request",
  "base_constraint": "refs/heads/main@eeeeeeeeeeeeeeeeeeeeeeeeeeeeeeeeeeeeeeee",
  "candidate_tree_oid": "aaaaaaaaaaaaaaaaaaaaaaaaaaaaaaaaaaaaaaaa",
  "change_request_id": "cr-1",
  "charter_digest": "sha256:cccccccccccccccccccccccccccccccccccccccccccccccccccccccccccccccc",
  "charter_rule_id": "rule.merge.protected-main",
  "footprint": {
    "namespace_roots": [
      "refs/heads"
    ],
    "reads": [
      {
        "expected_version": "1",
        "resource_id": "charter:main"
      }
    ],
    "writes": [
      {
        "expected_version": "1",
        "new_digest": "sha256:9999999999999999999999999999999999999999999999999999999999999999",
        "resource_id": "ref:refs/heads/main"
      }
    ]
  },
  "head_sha": "dddddddddddddddddddddddddddddddddddddddd",
  "kind": "actspec",
  "manifest": [
    {
      "content_digest": "sha256:ffffffffffffffffffffffffffffffffffffffffffffffffffffffffffffffff",
      "path": "docs/decision.md"
    }
  ],
  "merge_method": "merge",
  "nonce": "nonce-1",
  "permit": {
    "issuer_act_body_id": "sha256:083e58c2eb5b85955ac863342b0fa2df33c51de89f3cb392327f227552ca2a3a",
    "output_index": "0"
  },
  "reducer_version": "reduce/0.1.0",
  "repository_id": "github.com/arqtiqa/arqtos-core",
  "schema_version": "1",
  "valid_until": "2026-08-21T00:00:00Z"
}
